,Headline,Description,Cosine Similarity
1,Punjab CM Bhagwant Mann slams opposition for criticising MoU with Delhi,"Punjab Chief Minister Bhagwant Mann on Tuesday lashed out at the opposition parties, asking them to desist from issuing unfounded, illogical, frivolous and politically motivated statements criticising the AAP government’s recent landmark decisions.In a video message, Bhagwant Mann chided the Shiromani Akali Dal President Sukhbir Singh Badal for unleashing propaganda against the state government’s recent initiatives to rejuvenate the health and education sectors on Delhi model.Advising Sukhbir Badal, the CM said,”Healthy criticism is always welcomed but criticism for the sake of just criticism and political survival is highly deplorable.”Bhagwant Mann said the Akali Dal leadership was bereft of any constructive political agenda and hell bent on tarnishing AAP's image, which was voted to power with a thumping majority, thus decimating both Akali Dal and Congress parties from the Punjab polity.Bhagwant Mann rued that Akali Dal was making unnecessary hue and cry over the ‘Knowledge Sharing Agreement’ (KSA) in the field of Health & Education with the Delhi government.“Had the Congress and Shiromani Akali Dal, which ruled Punjab for 44 years, done something tangible for the welfare of the people and prosperity of the state, they would not have to face such humiliation"", he said.Further, Bhagwant said Sukhbir Badal should have patience at least for some time as AAP government had not completed its 44 days while the Congress remained in power for long period of over 25 years and Akali Dal ruled for 19 years.""Sukhbir Badal should not mislead the people by referring to false documents with regard to the KSA besides befooling the people spreading canards about Punjab’s AAP government being run from Delhi"", the CM said, adding that Sukhbir Badal had gone to China to forge a collaboration for power generation from paddy straw and his father Parkash Singh Badal had entered into several agreements in different fields with Ontario province of Canada. He questioned Sukhbir whether their government is run by the Chinese government or Ontario province.Read | AAP MLA welcomes Punjab govt’s decision to withdraw arrest warrants against farmersTaking MLA Partap Singh Bajwa to cudgels, the CM asked him to refrain from baseless accusations for sake of political bashing and reminded him the time when their party’s former chief minister was ordering posting and transfers of high-ups like Chief Secretary, DGP and senior bureaucrat at the instance of his foreign guest.“You were writing letters to the Chief Minister at that time showing displeasure over his autocratic style of functioning but later you too was seen having lunch and dinner with him”, the CM reminded Bajwa.Training guns at Navjot Sidhu, the CM said that first of all Sidhu should get his group recognised by the Congress Party, which was protesting against the power agreements at Rajpura and blaming AAP for the same. On Sidhu’s self-styled functioning, the PPCC President Raja Warring has even denounced him, saying that it was not a dharna of the Congress Party.He dared him, saying,”Why didn’t you join as power minister while you could have easily scrapped these power agreements.” He, however, said the AAP Government would soon rescind these agreements in the Punjab Assembly but unfortunately, you won’t be there in the House to witness this historic decision.Reiterating his government’s firm commitment to revive the lost glory of Punjab, Bhagwant Mann said that all of us being Punjabi should make Punjab a frontrunner state in the country.Without mincing any words, Bhagwant Mann said,”The AAP government would strive hard to replicate any worthwhile development model not within the country but across the globe and to ensure all round development of Punjab and the welfare of its residents.”Read | Congress's Raja Warring accuses Arvind Kejriwal of inaction over rising number of farmers' suicide in PunjabALSO READ | Punjab Health Dept bans use of bouquets, plastic bottles in official events",0.9999726023171511
2,Myanmar junta court convicts Aung San Suu Kyi of corruption,"A court in military-ruled Myanmar's capital Naypyitaw on Wednesday, April 27, convicted the country's former leader Aung San Suu Kyi of corruption, sources said.Suu Kyi (76), who was ousted by an army takeover in February last year, now faces up to 15 years in prison and a fine.ALSO READ | Myanmar’s Suu Kyi sentenced to 4 more years in prisonThe case was around allegations that the Nobel laureate had accepted 11.4 kg of gold and cash payments totalling $600,000 from her protege-turned-accuser, former Yangon chief minister Phyo Min Thein.Suu Kyi now has at least 10 more corruption cases pending against her.ALSO READ: Myanmar ousted leader Aung San Suu Kyi goes on trial; critics say charges bogusHer supporters and independent legal experts have decried her prosecution as unjust and meant to keep the 76-year-old Suu Kyi from returning to an active role in politics.She has already been sentenced to imprisonment in other cases and faces 10 additional corruption charges.ALSO READ: Myanmar's Suu Kyi jailed for four years for inciting dissent against Junta govtSuu Kyi's National League for Democracy party won a landslide victory in the 2020 general election, but lawmakers were not allowed to take their seats when the army seized power on Feb. 1, 2021, arresting Suu Kyi and many senior colleagues in her party and government.The army claimed it acted because there had been massive electoral fraud, but independent election observers didn't find any major irregularities.(With inputs from Reuters and AFP)",0.9999716111222212
3,"Patna to reel under heatwave conditions till Friday, MeT sounds yellow alert","Bihar's capital Patna is likely to remain in the grip of a heatwave for the next three days and the Patna Meteorological Centre (MeT) has sounded a yellow alert for heatwave in several districts in the state. Bihar has been reeling under a maximum temperature of 40 degrees Celsius and hot westerlies have been sweeping through the state, making conditions worse.The residents of Patna may not expect relief from hot weather conditions till Friday as the maximum temperature would breach the 40 degrees mark.According to MeT, most places in south Bihar may have maximum temperatures above 40 degree Celsius to 42 degrees Celsius, while northern parts of the state may experience 36 degrees Celsius to 40 degrees Celsius.Districts such as Patna, Bhagalpur, Jamui, Buxar, Vaishali, Khagaria, Banka, Nalana, Nawada, Rohtas, Jehanabad, Sheikhpura, Lakhisarai, Munger, Khagaria, West Champaran, East Champaran, Gopalganj, Siwan and Saran have been warned of heatwave in the coming days.The Patna Meteorological Centre has sounded a heatwave alert in the southern and north-western parts of Bihar on Wednesday. The weather agency has given a heatwave warning for the southern parts as well on Thursday and the maximum temperature is likely to breach the 40 degrees mark.On Tuesday, the maximum temperature was above the 40 degrees mark in 19 out of 38 districts in Bihar. Buxar was the hottest place in the state on Tuesday with the maximum temperature at 44.7 degrees Celsius.ALSO READ| Heatwave conditions likely in Bihar till April 26: MeTGaya and Patna had the maximum temperature at 43 degrees Celsius, which is expected to soar in the next three days.Patna, Bhagalpur, Jamui, Buxar, Vaishali, Khagaria, Banka, Nawada and Nalanda experienced heatwave conditions on Tuesday too. However, north-eastern parts of the state can expect some relief from the scorching heat as the weatherman has predicted thunderstorms and lightning in Araria, Kishanganj, Sheohar, Sitamarhi, West Champaran and East Champaran.The IMD declares a heatwave condition when the normal temperature is 40 degrees Celsius and more and the actual temperature continues to be 4.5 notches above normal for the two consecutive days.An official at Patna MeT told TOI, ""Hot westerly and north-westerly are sweeping through the state at an average speed of 10-12kmph. As a result, heatwave conditions are expected at a few places in south Bihar over the next two days. Besides, the day temperature can rise by two to four notches above the corresponding normal over next three days."" (sic)ALSO READ| Patna: PMCH metro station to be underground; two gates will be in campusALSO READ| NIT Patna student bags Rs 1.8 crore offer at Amazon",0.9999712904441994
4,"Blood of Chinese cannot be shed in vain, perpetrators should be punished: China after 3 killed in Pak blast","China on Wednesday asked Pakistan to scale-up security for its nationals working in the country and demanded a thorough investigation and punishment to the perpetrators behind the suicide attack at the Karachi University which killed three Chinese teachers and injured another.The blood of the Chinese cannot be shed in vain, and those behind this incident will surely pay the price, a Chinese foreign ministry spokesperson said while strongly condemning the latest attack on Chinese nationals working in Pakistan.An explosion triggered by a burqa-clad Baloch woman suicide bomber ripped through a shuttle passenger van of the Confucius Institute at the prestigious University of Karachi on Tuesday, leaving three Chinese teachers dead and one injured and causing several Pakistani casualties, in the latest targeted attack against Chinese citizens in Pakistan’s financial capital.ALSO READ | 3 Chinese nationals killed as mother of two blows up van outside Karachi UniversityChina expressed its “strong condemnation and great indignation” at the attack, as well as deep condolences to the victims and sincere sympathy to the injured and the bereaved families, the state-run Xinhua news agency quoted the spokesperson as saying.Chinese Assistant Foreign Minister Wu Jianghao has made an urgent phone call to the Pakistani Ambassador to China to express extremely grave concern, the report said.Wu demanded that the Pakistani side should immediately conduct a thorough investigation into the incident, apprehend and punish the perpetrators to the full extent of the law, and take all possible measures to ensure the safety of Chinese citizens in Pakistan and prevent such incidents from happening again, the spokesperson said.The Chinese Foreign Ministry and Chinese diplomatic missions in Pakistan will continue to urge relevant Pakistani departments to handle properly the follow-up matters of those killed, treat the injured, and resolutely crack down on the terrorist organisation involved, the spokesperson said.ALSO READ | A mother of 2 and wife of a doctor, Karachi suicide bomber held a master's degreeThe banned Balochistan Liberation Army (BLA) linked Majeed Brigade has claimed responsibility for the attack that took place near China-built Confucius Institute — a non-profit institute teaching Chinese language to local pupils — in Karachi University.A spokesperson for the university said that three of the victims were Chinese nationals. They were identified as Confucius Institute Director Huang Guiping, Ding Mupeng, Chen Sa and Khalid, the Pakistani driver.The spokesperson added that two others — Chinese national Wang Yuqing and a Pakistani man Hamid — were injured in the blast.CCTV footage of the attack showed a burqa-clad woman standing outside the entrance of the Confucius Institute. The woman detonated herself just as the van neared the institute’s entrance.A spokesperson of the BLA, the separatist outfit which is banned in Pakistan, the UK and the US, said that the attack was carried out by Shari Baloch alias Bramsh the “first female suicide bomber of the brigade”. The attack marks “a new chapter in the history of Baloch resistance,” he added.ALSO READ | What happened in Balochistan, stayed in BalochistanA picture of the bomber in circulation showed the woman along with her two small kids.In a purported video issued by the group, a BLA spokesman said that the motive of the attack was very clear.“It was a simple and clear message to China and Pakistan to withdraw immediately from Balochistan,” said the masked spokesman surrounded by armed men on a hilly terrain.“Baloch Liberation Army guarantees you the CPEC will fail miserably on Baloch land,” the spokesman, who was holding an assault rifle, said in fluent English. He warned that a special unit has been formed particularly to attack Chinese officials and installations in Balochistan.The group opposes Chinese investment in Pakistan, especially in the restive Balochistan, saying local people do not benefit.Balochistan, bordering Iran and Afghanistan, is home to a long-running violent insurgency. Baloch insurgent groups have previously carried out several attacks targeting the USD 60 billion China-Pakistan Economic Corridor (CPEC) projects.ALSO READ | Modi-Johnson talks: How India is countering China's influence in neighbourhoodThis is not the first-time Chinese nationals have been the target of terror attacks in Karachi, which is Pakistan’s biggest city and economic hub.In July last year, masked armed men on a motorcycle opened fire on a vehicle carrying two Chinese nationals in Karachi in which one of them was critically wounded.In the same month, nearly a dozen Chinese engineers were killed when a bus carrying construction workers was “attacked” in northwest Pakistan.In November 2018, Baloch militants had attacked the Chinese consulate in Karachi but failed to break through the security barrier with three of them killed on the spot.Thousands of Chinese personnel are working in Pakistan on a host of projects being carried out under the aegis of the CPEC.ALSO READ | China says Pakistan's political turmoil won't affect all-weather ties; oppose external interference",0.9999701327676406
5,Palm oil export ban by Indonesia begins tomorrow | All you need to know,"Indonesia, the world's top palm oil producer, will ban exports of refined, bleached and deodorized (RBD) palm olein, which are made by crushing palm fruit and processing it to remove impurities. The ban is set to begin on Thursday.President Joko Widodo announced the ban on Friday to help lower soaring domestic prices.Palm oil is used in everything from cakes, chocolate, margarine and frying fats to cosmetics, soap, shampoo and cleaning products.Small palm oil planters in Indonesia have enjoyed big paycheques in the past year as global vegetable oil prices surged, but these farmers fear they will bear the brunt of the pain from a new export ban coming into effect on Thursday.Local farmers said prices of fresh palm fruit bunches have already plunged in Kampar, Riau Province on Sumatra island, Reuters reported.Indonesia's ban on palm oil exports is unlikely to last more than a month as Jakarta has limited infrastructure to store the surplus oil and the country faces mounting pressure from buyers to resume shipments, industry officials in Indonesia were quoted as saying by Reuters.The shock move has lifted prices of all edible oils and sowed confusion and alarm among palm oil exporters and consumers alike.However, the stock market panic subsided after officials told palm oil executives the ban will only apply to exports of refined, bleached and deodorized (RBD) palm olein, and would not affect flows of crude palm oil or other forms of derivative products.However, Jakarta will widen the ban ""if there is a shortage of refined palm oil,"" according to a presentation the government gave to companies on Monday. RBD palm olein accounts for around 40% of Indonesia's total exports of palm oil products, according to analysts' estimates.Indonesia meets nearly 50 per cent of the total palm oil requirement in India annually.India consumes 22.5 million tonne of edible oil annually, of which 9-9.5 million tonne is met by domestic supplies and the rest by imports. About 3.5-4 million tonne of palm oil is imported by India annually from Indonesia, as per a PTI report.ALSO READ | Palm oil price to go up? Impact of export ban by Indonesia in India",0.9999694640425731
6,Beast box office collection Day 14,"Thalapathy Vijay's Beast has slowed down considerably in its second week. The film took a grand opening and had an eventful first week. However, it was overshadowed by Yash's KGF: Chapter 2 in the second week. With new releases slated to hit the theatres on April 28, Beast is nearing the end of its theatrical run. Directed by Nelson Dilipkumar, Beast is a hostage comedy drama.Thalapathy Vijay's Beast graced the cinemas on April 13. Though the film released in multiple languages, it received a massive response in Tamil. The film went on floors in April 2021 and saw the light of the day one year later, on April 13.According to trade analyst Manobala Vijayabalan, Beast collected Rs 152.21 crore in two weeks worldwide. He wrote, ""#Beast WW Box Office COLLAPSES Week 1 - Rs 143.72 cr. Week 2 Day 1 - Rs 1.96 cr. Day 2 - Rs 1.53 cr. Day 3 - Rs 1.30 cr. Day 4 - Rs 1.58 cr. Day 5 - Rs 1.75 cr. Day 6 - Rs 0.37 cr. Total - Rs 152.21 cr (sic).""#Beast WW Box OfficeCOLLAPSESWeek 1 - 143.72 crWeek 2Day 1 - 1.96 crDay 2 - 1.53 crDay 3 - 1.30 crDay 4 - 1.58 crDay 5 - 1.75 crDay 6 - 0.37 crTotal - 152.21 cr#VijayOn April 25, Beast collected Rs 64,000 in the USA, while KGF: Chapter 2, Jersey and RRR's collection were way higher than that.April 25 USA BO#KGF2 - $84,500 [64.75 Lacs]#JerseyMovie - $18,448 [14.14 Lacs] #RRRMovie - $5,291 [4.05 Lacs]#BeastMovie - $845 [64 Thousand]Beast is a hostage drama, directed by Nelson Dilipkumar. Produced by Sun Pictures, the film saw Thalapathy Vijay playing the role of RAW agent Veeraraghavan. The film features Pooja Hegde, Selvaraghavan, Shine Tom Chacko and Yogi Babu in important roles.",0.9999692915533058
7,"Bengaluru: Nearly three lakh citizens yet to take second Covid vaccine dose, contact tracing intensified","Even as the fear of a fourth Covid wave looms over Karnataka, around three lakh citizens of Bengaluru who are eligible to receive the second dose of the vaccine have not taken the jab. The Bruhat Bengaluru Mahanagara Palike (BBMP) and health officials from different primary health centres (PHCs) have been given the responsibility to contact the eligible individuals and request them to take the vaccine.The civic body has been conducting door-to-door surveys to convince people to take the Covid-19 vaccine and contact tracing has been intensified.Special Health Commissioner, health, BBMP, Dr KV Trilok Chandra said that health officials are now going to the homes of people who have not taken the second dose of the vaccine and are convincing them to administer the jab.“There still seems to be some resistance. We are convincing them to take the second dose. We are also following up on those who are eligible to take the precautionary dose,” he was quoted by the Hindu as saying.According to him, in the past two months, health workers serving with the BBMP along with the mobile vaccination units reached out to eight lakh people and they were given the second dose. With the Covid-19 cases rising in a few states, the BBMP too is likely to increase targeted testing.""Though cases are increasing, the number of people getting admitted to hospital is low. To ensure cases don’t rise, more attention is being paid to getting people vaccinated,"" he told the media on Tuesday.In a bid to ramp up Covid-19 testing, the BBMP has roped in more doctors, swab collectors and data entry operators. At present, people testing positive for the infection have reported mild to moderate symptoms and the number of hospitalisations is more in case of those who are unvaccinated and immuno-compromised, he added.ALSO READ| Bengaluru Rural becomes first district in Karnataka to achieve 100% Covid vaccination coverageRequesting people to follow appropriate Covid-19 protocols, Trilok Chandra said that marshals and police teams have been asked to keep a close watch on people in busy areas. The samples of suspected Covid-19 patients continue to be sent for genome sequencing and sero surveillance is also being carried out.""Marshals and police personnel have already been directed to create awareness about the importance of CAB, especially wearing masks and maintaining social distance among citizens in crowded areas. In the next phase, fines will be levied,” he said.ALSO READ| Bengaluru civic body makes fitness certificates mandatory for garbage trucks after 3 deathsMeanwhile, Karnataka reported 85 new Covid cases in the last 24 hours, taking the active number of cases in the state to 1,686. The state reported zero deaths on Tuesday and the death toll remained unchanged at 40,057, state health department bulletin said.Karnataka Health Minister K Sudhakar on Tuesday said that experts have predicted that the Covid-19 fourth wave may peak after June and have its effects till October. He stressed learning to live with the virus by taking precautionary measures like vaccinations and wearing masks.ALSO READ| Bengaluru Covid positivity rate comes down from 27.2% to 11.7% in 10 days as cases dip",0.9999692866274671
8,Watch LIVE | SpaceX launches four astronauts to Space Station on Falcon-9,"Four astronauts part of the Crew-4 mission were launched to the International Space Station on Wednesday. Nasa astronauts Kjell Lindgren, Robert Hines, and Jessica Watkins and European Space Agency astronaut Samantha Cristoforetti lifted off from Kennedy Space Centre.While this is the first spaceflight for Hines and Watkins, Lindgren and Cristoforetti have flown before. The crew will spend several months conducting science and maintenance aboard the orbiting laboratory before the four astronauts return to Earth in the fall of 2022.The crew is flying on a new Crew Dragon spacecraft and will launch on a Falcon 9 booster that has previously sent three missions into space. As per tradition, the Crew has named the new spacecraft as Freedom to celebrate a fundamental human right, and the industry and innovation that emanate from the unencumbered human spirit.Lindgren and Hines were assigned to the Crew-4 mission in February 2021 followed by Cristoforetti, who came on board in March 2021, and Watkins was added as the fourth crew member in November 2021.The mission will be commanded by Lindgren, who is responsible for all phases of flight, from launch to re-entry, and will serve as an Expedition 67 flight engineer aboard the station. This will be Lindgren’s second spaceflight since becoming an astronaut in 2009.Hines is the pilot of the Crew Dragon spacecraft and second in command for the mission. He is responsible for spacecraft systems and performance. Onboard the station, he will serve as an Expedition 67 flight engineer. Watkins is a mission specialist for Crew-4 and will work closely with the commander and pilot to monitor the spacecraft during the dynamic launch and re-entry phases of flight.Meanwhile, Cristoforetti will also serve as a mission specialist, working to monitor the spacecraft during the dynamic launch and re-entry phases of flight. This will be her second trip to space following five months in 2015 as an Expedition 42/43 flight engineer. Born in Milan, Italy, she was a fighter pilot in the Italian Air Force prior to being selected as an ESA astronaut in 2009.The Falcon 9 first stage that was used to launch this mission flew previously on SpaceX’s 22nd commercial resupply mission to the station in June 2021, NASA’s SpaceX Crew-3 mission in November 2021, and SpaceX’s Turksat 5B mission in December 2021. This was the first crew launch on a booster making its fourth flight.",0.9999691250702623
